{
  "gridPx": 16,
  "faceScale": 1.3,
  "faceHdr": 3.0,
  "backlightHdr": 0.3,
  "heldDim": 0.2,
  "scanlineAmount": 0.18,
  "scanlineSpeed": 6,
  "aberrationPx": 0.12,
  "blinkPeriodSec": 0.2,
  "shell": { "color": "#101218", "roughness": 0.22, "metalness": 0.5 },
  "light": { "intensity": 4, "rangeM": 6 },
  "colors": { "smile": "#35f2ff", "nervous": "#ffd23f", "angry": "#ff3b3b", "blink": "#ff3b3b", "crack": "#ffffff" },
  "frames": {
    "smile": [
      "................",
      "................",
      "...##......##...",
      "..#..#....#..#..",
      "................",
      "................",
      "................",
      "................",
      "..#..........#..",
      "...#........#...",
      "....##....##....",
      "......####......",
      "................",
      "................",
      "................",
      "................"
    ],
    "nervous": [
      ".............#..",
      "............###.",
      "..##....##..###.",
      ".#..#..#..#..#..",
      "................",
      "..##......##....",
      "..##......##....",
      "................",
      "................",
      "................",
      "...##..##..##...",
      "..#..##..##..#..",
      "................",
      "................",
      "................",
      "................"
    ],
    "angry": [
      "................",
      "..##........##..",
      "...##......##...",
      "....##....##....",
      "................",
      "...###....###...",
      "...###....###...",
      "................",
      "................",
      "......####......",
      ".....#....#.....",
      "....#......#....",
      "...#........#...",
      "................",
      "................",
      "................"
    ],
    "crack": [
      "........#.......",
      ".......#........",
      "..#.#...#..#.#..",
      "...#.....#..#...",
      "..#.#...#..#.#..",
      ".........#......",
      "........#.......",
      ".......#........",
      "................",
      "..#.#.#.#.#.#...",
      "...#.#.#.#.#.#..",
      "................",
      "......#.........",
      ".....#..........",
      "................",
      "................"
    ]
  }
}
